[
    {
        "out_layer": "parks",
        "source": "https://cosmos.surrey.ca/geo_ref/Images/OpenDataArchives/parks_GDB.zip",
        "source_layer": "parks",
        "protocol": "http",
        "fields": [
            "FACILITYID",
            "DESCRIPTION",
            "LOCATION",
            "PARK_NAME",
            "STATUS"
        ],
        "primary_key": ["FACILITYID"],
        "schedule": "Q"
    }
]
