[
  {
    "out_layer": "roads",
    "source": "/vsizip//vsicurl/https://opendata.chilliwack.com/shp/Roads_SHP.zip",
    "source_layer": "Roads",
    "protocol": "http",
    "fields": [
      "NAME",
      "TYPE",
      "SURFACE",
      "DIRECTION",
      "AssetID"
    ],
    "schedule": "Q",
    "primary_key": [
      "AssetID"
    ]
  },
  {
    "out_layer": "parks",
    "source": "/vsizip//vsicurl/https://opendata.chilliwack.com/shp/Parks_SHP.zip",
    "source_layer": "Parks",
    "protocol": "http",
    "fields": [
      "NAME"
    ],
    "schedule": "Q"
  }
]
