[
  {
    "out_layer": "parks",
    "source": "/vsizip//vsicurl/https://www.nanaimo.ca/GISFiles/shp/Parks.zip",
    "source_layer": "PARKS",
    "protocol": "http",
    "fields": [
      "PARKNAME",
      "PARKADDRESS",
      "CITYOWNED",
      "GLOBALID",
      "PARKID"
    ],
    "primary_key": [
      "PARKID"
    ],
    "schedule": "Q"
  },
  {
    "out_layer": "roads",
    "source": "/vsizip//vsicurl/https://www.nanaimo.ca/GISFiles/shp/RoadNetwork.zip",
    "source_layer": "ROAD_CENTERLINES",
    "protocol": "http",
    "fields": [
      "STREETNAME",
      "CLASS",
      "SURFACE",
      "GID"
    ],
    "schedule": "Q",
    "primary_key": [
      "GID"
    ]
  }
]
