[
  {
    "out_layer": "roads",
    "source": "https://maps.kamloops.ca/arcgis/rest/services/OpenData/OpenDataPlanimetric/MapServer/28",
    "protocol": "esri",
    "fields": [
      "FACILITYID",
      "STREETNAME",
      "ALTERNATENAME",
      "RANGETYPE",
      "BEGINLEFT",
      "BEGINRIGHT",
      "ENDLEFT",
      "ENDRIGHT",
      "TRAFFICDIRECTION",
      "ASSETSTATUS"
    ],
    "schedule": "Q",
    "primary_key": [
      "FACILITYID"
    ]
  },
  {
    "out_layer": "parks",
    "source": "/vsizip//vsicurl/https://maps.kamloops.ca/OpenData/zipfiles/ParksSHP.zip",
    "source_layer": "Park",
    "protocol": "http",
    "fields": [
      "NAME",
      "ADDRESS",
      "SITETYPE",
      "CLASSIFICA"
    ],
    "schedule": "Q"
  }
]
