[
    {
        "out_layer": "roads",
        "source": "/vsizip/{/vsicurl/https://governmentofbc.maps.arcgis.com/sharing/rest/content/items/4bba119c2e9042d683cc9378fb1e836e/data}/CoL_TransportationNetwork Jan 3 2024.gdb",
        "source_layer": "TRN_ROADS",
        "protocol": "http",
        "fields": [
            "GISLINK",
            "NAME",
            "CLASSIFICATION",
            "OWNER",
            "FROM_LOCATION",
            "TO_LOCATION"
        ],
        "primary_key": ["GISLINK"],
        "schedule": "Q"
    }
]